{
  "spec_id": "B0",
  "source": "manual",
  "provenance": {
    "model": null,
    "prompt_version": null,
    "iteration": 0,
    "sample_idx": 0,
    "reference": null
  },
  "description": "B0 = SUMO defaults (PLAN Phase 2.1) written as a spec: one archetype per vTypeDistribution with no params and no TraCI rules, so every attribute keeps its SUMO vClass default (custom1 = moto_violator gets the motorcycle defaults, as in the hand-written rules/compiled/B0/vtypes.add.xml). Compiling it gives the same vTypes as the hand-written file (tests/test_compiler.py::test_B0_spec_equivalent_to_handwritten); the hand-written file stays the one the runner uses.",
  "driver_archetypes": [
    {
      "id": "car_B0",
      "base_vclass": "passenger",
      "share": 1.0,
      "params": {},
      "rationale": "SUMO passenger defaults."
    },
    {
      "id": "moto_B0",
      "base_vclass": "motorcycle",
      "share": 1.0,
      "params": {},
      "rationale": "SUMO motorcycle defaults."
    },
    {
      "id": "moto_violator_B0",
      "base_vclass": "custom1",
      "share": 1.0,
      "params": {},
      "rationale": "SUMO motorcycle defaults on vClass custom1 (the only class allowed on the banned LVL_W left turn)."
    }
  ],
  "traci_rules": []
}
